{
  "schemaVersion": "1.0.0",
  "evidenceClass": "development-local-joint-review-candidate",
  "contractStatus": "T018-Proposed-local-identity-only",
  "jointAcceptance": false,
  "dcp1bAuthority": false,
  "webContract": {
    "projectionVersion": "3.0.0",
    "commit": "38449c320e0fbaec1dba38f56c0f9570384f8b60",
    "tree": "cf3cac41763938546af9d6f662167b17f3197288",
    "files": [
      {
        "path": "plans/13-developer-control-plane/01-foundation-and-interface-contract.md",
        "blob": "2bce690dacd927af5742872c6a69f8a6633a3bf2",
        "sha256": "36B2F1A4C66D1FEE8754EB47AC49B3BDCF823CD3C2375FC6C333A098C96EC5BB"
      },
      {
        "path": "plans/11-implementation/01-phased-implementation-plan.md",
        "blob": "6be1cbcbdc04eb5f117a3c21bafe2276c7c1a62e",
        "sha256": "63EAB6D1B69BA1C7EE9FC94C4EF85AC62D0C5822A53B1BBF6AFE71CF412FF4BD"
      },
      {
        "path": "docs/decisions/ADR-0016-developer-control-plane-projection-and-verifier-contract.md",
        "blob": "a9de1e96308c39923ffbdcec3db210d87c139efd",
        "sha256": "2F8CA59E6A8AF28F1DAF7524AB2DCEC461F2E401C98163FB527F6A3564D93D13"
      },
      {
        "path": "docs/interfaces/data-platform-api-key-projection-v3-web-proposal.md",
        "blob": "d3eda869a30a5af235f916f5bd982fdeb2cb70e0",
        "sha256": "BC3F7942AA2368C3D50068F1EE6ACD536AEFA14599EEB43EFD619C1E3539F4F0"
      }
    ]
  },
  "localEvidence": {
    "f": {
      "commit": "83548d8fdd636f3ceb222036ad115983401ce0fb",
      "parent": "38449c320e0fbaec1dba38f56c0f9570384f8b60",
      "tree": "42bd3051e2196c32f640e0ef032af6cd2519d851",
      "diffPaths": [
        "docs/interfaces/fixtures/data-platform-api-key-projection-v3/acknowledgement-replay-cases.json",
        "docs/interfaces/fixtures/data-platform-api-key-projection-v3/adapter-cases.json",
        "docs/interfaces/fixtures/data-platform-api-key-projection-v3/event-cases.json",
        "docs/interfaces/fixtures/data-platform-api-key-projection-v3/failure-redaction-cases.json",
        "docs/interfaces/fixtures/data-platform-api-key-projection-v3/manifest.json",
        "packages/developer-control-plane/src/projection-v3-readiness.ts",
        "scripts/developer-control-plane-projection-v3-readiness.ts",
        "tests/developer-control-plane-projection-v3-readiness.test.ts"
      ]
    },
    "r": {
      "commit": "52e120253c60047f4eadec30dafb5fa7981ac947",
      "parent": "83548d8fdd636f3ceb222036ad115983401ce0fb",
      "tree": "5d517f9ba396acffaa81ed01325f237a4acfd92f",
      "diffPaths": [
        "packages/developer-control-plane/src/projection-v3-readiness.ts",
        "tests/developer-control-plane-projection-v3-readiness.test.ts"
      ]
    },
    "receipts": {
      "historicalBlockedT020": "CF67A0792F2CC4E3898D24A48EC7D2520D9CEAD72DA0B9DF11E5773873B17D49",
      "t020Completion": "5354FDBD752ABBFDB51F44AE20EA11B80391EFA5FDB8C5D29984AEBB3225FC4D",
      "t021": "163F35E1354E73C08F15EE0206E8B451CD7275F15058251CB2B25E9EA54474C4",
      "t022": "86DE210F82FE291BF0806F5EAD264317936C56A23567DA50A6FA49768FA2EF8E"
    }
  },
  "dataDependency": {
    "commit": "d21efabb8550578333fee5f62bf0e822fbca1394",
    "tree": "5c3a56a25f4eb374e94550f89b9ed1dbd52bb66a",
    "status": "producer-local-v2-only",
    "resumeReview": "fresh-T681-review-after-T023"
  },
  "fixtureCorpus": [
    {
      "path": "docs/interfaces/fixtures/data-platform-api-key-projection-v3/manifest.json",
      "blob": "25b2ac777cf3ccb3a67a3170038adaa68776b0f4",
      "sha256": "716EC2E23E17FD3F603ED509FE0122665AB43934641B7309EFFFBDD88FAC2167"
    },
    {
      "path": "docs/interfaces/fixtures/data-platform-api-key-projection-v3/adapter-cases.json",
      "blob": "43dc34320d0f89d2cb6b1f7de0cf2b2ff94fc776",
      "sha256": "D0CD1A6F093C1CC4DB9C4D7B6CE53F519B80DACEB9F0E6235ECE15D974E708E3"
    },
    {
      "path": "docs/interfaces/fixtures/data-platform-api-key-projection-v3/event-cases.json",
      "blob": "2b09662ab3db2d58f05d3b44baa59cf9601c2af0",
      "sha256": "C21876A364980C349AAE3DFC863A083F3DED68B678260809969050568FE6F950"
    },
    {
      "path": "docs/interfaces/fixtures/data-platform-api-key-projection-v3/acknowledgement-replay-cases.json",
      "blob": "29afb740633a037d2a17191ab05dd82cb9f461f3",
      "sha256": "BA95726D69F0A56E1D3F9C93D091BEDE3798539DA03AA1E37C3C60EC2E010D2B"
    },
    {
      "path": "docs/interfaces/fixtures/data-platform-api-key-projection-v3/failure-redaction-cases.json",
      "blob": "1686ac5a96c0f621d0730e8b5b9fc0f8a227ab95",
      "sha256": "174D57B2A1F9484F9752353C24520AF0236E2E966658EDB32C0C597B01C55AD6"
    }
  ],
  "jointCaseFile": "joint-review-cases.json",
  "localFixtureVocabulary": {
    "envelopeFields": [
      "committed_at",
      "event_id",
      "event_type",
      "key_id",
      "organization_id",
      "organization_sequence",
      "payload",
      "policy_version",
      "project_id"
    ],
    "projectionVersion": "absent-from-F",
    "occurredAt": "absent-from-F",
    "canonicalization": "restricted-canonicalFixtureJson-six-local-events-only",
    "wireStatus": "full-RFC8785-bytes-pending"
  },
  "contractRules": {
    "counterRange": "finite-positive-safe-integer-1-to-9007199254740991",
    "policyAndOrder": "policy_version-distinct-from-organization_sequence",
    "events": [
      "key.verifier_published",
      "key.rotated",
      "key.revoked",
      "key.policy_changed",
      "project.activated",
      "project.disabled",
      "organization.disabled",
      "projection.heartbeat"
    ],
    "scopes": "bulk:read,data:read,geometry:read,provenance:read-sorted;empty-only-policy-change",
    "rotation": "exactly-86400-seconds-exclusive-boundary",
    "acknowledgement": "durable-before-return-exact-duplicate-bytes-mismatch-quarantine",
    "descriptor": "opaque-versioned-non-plaintext-unbound"
  },
  "jointOwnership": [
    {
      "evidence": "producer lifecycle, project binding, policy/order, idempotency, redaction, and compensation",
      "producer": "Web",
      "acceptanceOwners": ["Web", "Data", "Security", "Privacy", "Operations"]
    },
    {
      "evidence": "ordered application, verifier binding after approval, acknowledgement, watermark, and usage denial",
      "producer": "Data",
      "acceptanceOwners": ["Data", "Web", "Security", "Operations"]
    },
    {
      "evidence": "provider lifecycle, portable descriptor feasibility, binding, rotation, and availability",
      "producer": "Provider",
      "acceptanceOwners": ["Provider", "Web", "Security", "Operations"]
    },
    {
      "evidence": "scheme registry, comparison behavior, malformed handling, and failure boundaries",
      "producer": "Security",
      "acceptanceOwners": ["Security", "Web", "Data"]
    },
    {
      "evidence": "field minimization, retention, deletion, telemetry, and evidence redaction",
      "producer": "Privacy",
      "acceptanceOwners": ["Privacy", "Web", "Security"]
    },
    {
      "evidence": "authenticated delivery, credential references, limits, monitoring, and rollback",
      "producer": "Operations",
      "acceptanceOwners": ["Operations", "Web", "Data", "Security"]
    }
  ],
  "unresolvedInputs": [
    {
      "id": "provider-registry",
      "status": "pending",
      "owner": "Provider plus Web",
      "requiredEvidence": "Better Auth lifecycle and project-binding receipt with portable descriptor feasibility, compensation, and availability"
    },
    {
      "id": "security-registry",
      "status": "pending",
      "owner": "Security",
      "requiredEvidence": "approved opaque scheme registry, comparison boundary, malformed handling, rotation, and failure receipt"
    },
    {
      "id": "wire-canonical-bytes",
      "status": "pending",
      "owner": "Web plus Data",
      "requiredEvidence": "full wire envelope with occurred_at, RFC 8785 bytes and digest, and exact lifecycle mapping"
    },
    {
      "id": "quarantine-reason-codes",
      "status": "pending",
      "owner": "Data plus Security",
      "requiredEvidence": "closed acknowledgement outcomes, reason registry, replay, gap, rollback, freshness, and unknown handling"
    },
    {
      "id": "authenticated-acknowledgement",
      "status": "pending",
      "owner": "Operations plus Data",
      "requiredEvidence": "authenticated acknowledgement integrity, at-least-once delivery, limits, dead-letter handling, and monitoring"
    },
    {
      "id": "transport-credential-binding",
      "status": "pending",
      "owner": "Operations plus Security",
      "requiredEvidence": "managed credential references, workload identity, rotation, least privilege, and cleanup evidence"
    },
    {
      "id": "joint-owner-receipts",
      "status": "pending",
      "owner": "Web, Data, Provider, Security, Privacy, Operations",
      "requiredEvidence": "joint fixtures for lifecycle, ordering, duplicate, replay, compensation, disable, redaction, and acknowledgement cases"
    },
    {
      "id": "data-t681-review",
      "status": "pending",
      "owner": "Data",
      "requiredEvidence": "fresh T681 compatibility review bound to T023 and the unchanged producer-local identity"
    }
  ],
  "authorityDenials": [
    "no-final-verifier-scheme",
    "no-final-key-format",
    "no-provider-activation",
    "no-transport-or-secret-binding",
    "no-live-database-or-network",
    "no-Data-v2-semantic-adoption",
    "no-DCP-1B-or-production-acceptance",
    "no-relabeling-F-as-wire-acceptance"
  ]
}
